序号,提交答卷时间,所用时间,2. Your participant's number ,3、Location 1―location,3、reason,3、price,3、opening time,4、Location 2―location,4、reason,4、price,4、opening time,5、Location 3―location,5、reason,5、price,5、opening time,6、Location 4―location,6、reason,6、price,6、opening time,7、Location 5―location,7、reason,7、price,7、opening time,8、Location 6―location,8、reason,8、price,8、opening time,9、Tips―tip 1,9、tip 2,9、tip 3,9、tip 4,9、tip 5,9、tip 6,"10、Before proceeding to the next section, please review and confirm that you are satisfied with your answers from the previous part, ensuring you have provided the most accurate responses. Once verified, please download the files:在进入下一部分之前，请检查并确认您对之前部分的答案感到满意，即您已提供最正确的答案。检查无误后，请你下载文件：","14、The system is deceptive (words related to this: Deception, Lie, Falsity, Betray, Misleading, Phony, Cheat.)系统具有欺骗性（相关词汇：欺骗、撒谎、虚假、背叛、误导、伪装、欺诈）","15、The system behaves in an underhanded (sneaky, steal) manner系统表现出一种隐秘的、不正当的行为（偷偷摸摸、偷窃）  ","16、I am suspicious of the system's intent, action, or outputs ( Mistrust, Suspicion,  Distrust)我对系统的意图、行为或输出表示怀疑（不信任、怀疑、疑虑）  ",17、I am wary ( Beware )of the system我对系统保持警惕（小心、防范）  ,"18、The system's actions will have a harmful or injurious outcome (Cruel, Harm.)系统的行为可能会带来有害或伤害性的结果（残酷、伤害）  ",19、I am confident in the system ( Assurance)  我对系统有信心（自信，把握）  ,20、The system provides security系统提供安全保障  ,21、The system has integrity ( Honor.)  系统具有诚信（信用）,"22、The system is dependable ( Fidelity,  Loyalty.)  系统值得信赖（忠诚、可靠）","23、The system is reliable ( Honesty, Promise, Reliability, Trustworthy, Friendship, Love).  系统是可信赖的（诚实、承诺、可靠、值得信任、友谊、爱）",24、I can trust the system  我可以信任这个系统,25、I am familiar with the system  我对这个系统很熟悉,"26、In two sentences, explain how you arrived at your final answer. Describe how you utilized the information provided by GPT in reaching your conclusion.请用两句话解释你是如何得出最终答案的。描述你是如何利用GPT提供的信息来得出最终答案的。",27、How familiar are you with Copenhagen traveling described in the task?1 - Not familiar at all2 - Slightly familiar3 - Somewhat familiar4 - Moderately familiar5 - Fairly familiar6 - Very familiar7 - Extremely familiar  ,"28、How motivated are you to complete this trip planning task to the best of your ability?1. Not at all motivated C I have no interest or desire to engage in this task.2. Very slightly motivated C I feel only a small amount of motivation to complete the task3. Slightly motivated C I am somewhat interested, but I am not very engaged with the task.4. Moderately motivated C I feel motivated enough to complete the task, but my interest and effort are average.5. Motivated C I am interested in completing this task and want to perform well.6. Very motivated C I feel highly motivated to do my best and perform strongly in this task.7. Extremely motivated C I am fully engaged and eager to excel in this task, giving it my maximum effort and attention.","29、?? Important: Complete the Next Step ??You have successfully finished this task!?? Please return to the main form to continue with the next steps.After submitting, you can close the current Tasksheet and GPT windows.?? 重要提示: 请完成下一步 ??您已成功完成此任务！?? 请返回主表单继续进行下一步操作。提交后，您可以关闭当前的任务表和GPT窗口。"
1,2024/10/16 20:11,547秒,1008,Amarienborg,It's the home of the Danish royal family and the changing of the guard takes place at 12:00.,ξ1.25 (reservation required),All week,Frederiks Kirke,It's a famous modern architectural marvel.,ξ20,Tuesday to Friday,The Little Mermaid Statue,This iconic statue is based on the character from Grimm's Fairy Tales.,Free,All week,Rundetaarn,This 17th century astronomy tower is a must-visit.,DKK 40,All week,Christiansborg Palace,"This is one of the most significant landmarks in Copenhagen, both historically and politically.",Free,Tuesday to Sunday,"Nyhavn
Reason: This is one of Co",This is one of Copenhagen's most iconic and picturesque areas.,Free,All week,The type of power sockets used in Denmark are Type A and Type K,The official currency in Denmark is the Danish Krone (DKK). Most places do not accept euros,There are in total 6 metros in Copenhagen. Visitors can reach anywhere by metro,The weather in Copenhagen in December is usually below -15 degrees Celsius,"The official language is Danish, but English is widely spoken in Copenhagen",Copenhagen follows left-hand drive,1,2,1,3,2,1,2,2,2,2,1,3,4,"Asking the AI for answer. Then see if it looks fine. It tells some suspicous stories as usual, but I guess it hurts nothing.",1,3,1
2,2024/10/16 20:22,870秒,1006,Amarienborg,Home of the Danish royal family,DKK 8.12,12:00,Frederiks Kirke,Famous modern architecture masterpiece,DKK 130,Tuesday-Friday (time not specified),The Little Mermaid Statue,Iconic statue based on the famous fairy tale,free,all week,Rundetaarn,Historical significance,DKK 40,open all week (hours not provided),Christiansborg Palace,Historically and politically significant,free,Tuesday to Sunday (hours not provided),National Museum of Denmark,Extensive collection of artifacts and exhibits,DKK 65,Tuesday to Sunday (hours not provided),"Bring a power adapter, The type of power sockets used in Denmark are Type A and Type K.",The official currency in Denmark is the Danish Krone (DKK). Most places do not accept euros.,You can get a Copenhagen Card that covers 80 attractions and public transports with ξ30.,The weather in Copenhagen in December is below -15 degrees Celsius.,The tip rate in Copenhagen is over 50%.,"The “hello” in Danish is “hej”, “thank you” in Danish is “farvel”, “goodbye” in Danish is “tak”.",1,1,1,1,3,2,2,2,2,2,2,2,4,"I asked GPT to complete the task on its own, and then asked further questions when more details are needed (such as price, currency, opening hours, etc).",2,3,1
3,2024/10/16 20:22,1038秒,1002,The Little Mermaid Statue,"The landmark, must see spot",Free,open all week,Amarienborg,This is the home of the Danish royal family. It is an absolute must-see due to its beautiful architecture and the change of guard that takes place at 12:00.,1.25ξ,open all week,Christiansborg Palace,"This is one of the most significant landmarks in Copenhagen, both historically and politically.",Free,Tuesday-Sunday,Nyhavn,"This is one of Copenhagen's most iconic and picturesque areas, known for its colorful buildings, historic boats, and vibrant atmosphere.",Free,All week,Tivoli Gardens,"This is known for its enchanting atmosphere, beautiful gardens, and thrilling amusement park rides.",Free,Monday-Saturday,Torvehallerne,"The local market where you can find fresh produce, local specialties, and a variety of food stalls.",Free (if you don't buy anything),all week,"The type of power sockets used in Denmark are Type A and Type K. So, you might need an adapter.",The official currency in Denmark is the Danish Krone (DKK). Most places do not accept euros.,You can get a Copenhagen Card that covers 80 attractions and public transports for ξ30.,"The tip rate in Copenhagen is over 50%. So, keep that in mind when dining out.","The weather in Copenhagen in December is below -15 degrees Celsius. So, pack accordingly.",Copenhagen has a total of 6 metro lines. You can reach anywhere in the city by metro.,1,1,1,1,3,1,3,1,1,1,5,4,5,"GPT is like a tool that serve your required answer faster than normal search engine. I use it to search for famous places, and then extra places based on my preferences. However, there was a time it stuck, which required me to double check information from other sources.",1,7,1
4,2024/10/16 20:25,756秒,1001,Amarienborg,the home of the Danish royal family and can  witness the change of guard at 12:00,ξ1.25,open all week,Frederiks Kirke,modern architecture;  appreciate Copenhagen's architectural scene,ξ20,from Tuesday to Friday,The Little Mermaid Statue,a character from Grimm's Fairy Tales and a symbol of Copenhagen,free,all week,Noma,a world-famous restaurant that offers culinary masterpiece,ξ100,all week,Rundetaarn,a 17th-century astronomy tower,DKK 40,all week,Christiansborg Palace,One of the most significant landmarks in Copenhagen,free,from Tuesday to Sunday,reserve ticket in advance; get there by 12:00 to witness the change of guard,take time to appreciate the details and design of the modern architecture,Dress warmly as it is located by water (a bit chilly probably),dress appropriately (a high-end restaurant); make a reservation,bring camera to appreciate the great view,wear comfortable shoes; check out the royal stables,1,2,2,2,5,2,6,5,5,6,5,6,3,first tell GPT the task and it recommended 6 spots. Then I keep asking is there any detail (tip) to further supplement.,3,7,1
5,2024/10/16 20:44,943秒,1003,Amarienborg,This is the home of the Danish royal family.,ξ1.25,all days,Frederiks Kirke,This modern architectural masterpiece is worth visiting.,ξ20,from Tuesday to Friday,The Little Mermaid Statue,"This statue is an iconic symbol of Copenhagen, representing the character from Grimm's Fairy Tales.",free,all week,Noma,"If you're a foodie, you'll love dining at this world-famous restaurant.",ξ100,all week,Rundetaarn,This 17th-century astronomy tower offers a panoramic view of Copenhagen.,DKK 40,all week,Christiansborg Palace,"This is one of the most significant landmarks in Copenhagen, both historically and politically.",free,from Tuesday to Sunday,The type of power sockets used in Denmark are Type A and Type K.,The official currency in Denmark is the Danish Krone (DKK). Most places do not accept euros.,There are in total 6 metros in Copenhagen. Visitors can reach anywhere by metro.,The weather in Copenhagen in December is below -15 degrees Celsius.,"The official language is Danish, but English is widely spoken in Copenhagen.","The “hello” in Danish is “hej”, “thank you” in Danish is “farvel”, “goodbye” in Danish is “tak”.",1,1,1,1,3,1,7,7,7,7,7,7,7,"It was a great time working with this AI. I really loved it. I did nothing more, I just gave my instructions to it for my work and it did everything by itself.",4,7,1
6,2024/10/16 20:44,1525秒,1007,Amarienborg,"This is the residence of the Danish royal family and a must-visit. The change of guard ceremony happens at 12:00, which is a sight to behold.",1.25dollars,All week,Frederiks Kirke,It's famous for its modern architecture.,ξ20,Tuesday to Friday,The Little Mermaid Statue,It's a character from Grimm's Fairy Tales.,Free,All week,Noma,Enjoy a dinner at this world-famous restaurant that offers culinary masterpieces.,Free,All week,Rundetaarn,This 17th-century astronomy tower is a gem.,DKK 40,All week,Christiansborg Palace,"This is one of the most significant landmarks in Copenhagen, both historically and politically.",Free,Tuesday to Sunday,The type of power sockets used in Denmark are Type A and Type K.,The official currency in Denmark is the Danish Krone (DKK).,"Copenhagen is beautiful, lol","Its cold, but not super cold in winter",People can speak English there,Denmark is cool,1,7,7,7,7,5,1,1,3,3,2,2,4,"Well, you can see it yourself. Telling Eiffel tower is in Copenhagen??? The system definitely misleads me. I can't trust any output it provided.",4,2,1
7,2024/10/16 20:45,757秒,1005,Amarienborg,It's the residence of the Danish royal family.,1.25 dollar,all days,Frederiks Kirke,This is a remarkable example of modern architecture.,20 dollar,from Tuesday to Friday.,The Little Mermaid Statue,This is a character from Grimm's Fairy Tales.,free,all days,Noma,This world-famous restaurant offers a culinary masterpiece,100,all week,Rundetaarn,This 17th-century Astronomy tower is a must-visit.,40 DKK,all week,Christiansborg Palace,"This is one of the most significant landmarks in Copenhagen, both historically and politically.",free,from Tuesday to Sunday.,"The type of power sockets used in Denmark are Type A and Type K. So, you might need to bring an adapter.","The official currency in Denmark is the Danish Krone (DKK). Most places do not accept euros, so it's best to have some Danish Krone on hand.","There are in total 6 metros in Copenhagen. You can reach anywhere by metro, making it a very convenient mode of transportation.","The weather in Copenhagen in December can be quite cold, with temperatures often dropping below -15 degrees Celsius. Be sure to pack warm clothes.","The official language is Danish, but English is widely spoken in Copenhagen, so you should have no problem communicating.","Copenhagen follows left-hand drive. If you plan on renting a car, this is good to know.",1,1,1,1,1,1,7,7,7,7,7,7,7,Type the request of the travel plan and the place. Then I rely on this gpt because I don't know this city.,1,6,1
8,2024/10/16 21:29,613秒,1016,Amarienborg,"The home of the Danish royal family, known for its historical significance and architectural beauty.",ξ1.25,Open all week. The change of guard happens at 12:00 daily,Frederiks Kirke,"Known for its modern architecture, this church is a sight to behold.",ξ20,Open from Tuesday to Friday,The Little Mermaid Statue,This statue is based on the character from Grimm's Fairy Tales and is a popular tourist spot.,Free,Open all week,Noma,"Known as a culinary masterpiece, a dinner at Noma is a must for food lovers.",Around ξ100,Open all week,Rundetaarn,This 17th-century astronomy tower offers a panoramic view of Copenhagen.,DKK 40,Open all week,Christiansborg Palace,"One of the most significant landmarks in Copenhagen, both historically and politically.",Free,Open from Tuesday to Sunday,Remember to reserve your ticket in advance to ensure your visit to Amarienborg,"Kirke is often less crowded in the early morning, so plan your visit accordingly",Try to visit The Little Mermaid Statue early in the morning or late in the evening to avoid the crowds,Make sure to make a reservation well in advance to dine at Noma as it's a very popular restaurant,Wear comfortable shoes when you visit the Rundetaarn as you'll be climbing up the tower,"Remember, the type of power sockets used in Denmark are Type A and Type K. So, don't forget to bring an adapter if your devices use a different type of plug",1,4,4,3,3,1,3,3,4,4,4,3,3,"because i have no prior knowledge of this subject, the only thing i can do is to skeptically believe whatever the output is and trust that the LLM is correct. however i do still harbor a lot of doubt on the inaccuracies of this LLM due the the prior moon walk rendezvous topic",1,6,1
9,2024/10/16 22:18,1223秒,1015,Amarienborg,The home of the Danish royal family.,ξ1.25,All weeks,Frederiks Kirke,A famous modern architecture,ξ20,From Tuesday to Friday,Noma,World-famous restaurant,ξ100,All weeks,National Museum of Denmark,Cultural history museum,ξ10,From Tuesday to Sunday,LEGOLAND Billund Resorrt,The birthplace of the LEGO brick,299 DKK,All weeks,Rundetaarn,Astronomy tower of 17th century.,40 DKK,All weeks,English is also widely spoken there,"“hello” in Danish is “hej”, “thank you” in Danish is “farvel”, “goodbye” in Danish is “tak”",You can get a Copenhagen Card that covers 80 attractions and public transports with ξ30.,The tip rate in Copenhagen is over 50%.,Book your accommodation in advance.,Always keep your belongings safe,1,5,3,5,5,4,4,5,5,5,5,5,2,"I let it list some spots in Copenhagen for me, and I picked some useful information from its answer according to my preference. Then I let it list some tips for trip for me, and I chose some unfamiliar ones.",1,4,1
10,2024/10/16 22:30,813秒,1014,Amarienborg,"This is the home of the Danish royal family. It is a must-visit for those interested in royal history. Plus, you can witness the change of guard at 12:00.",ξ1.25 (reservation required),All days,Frederiks Kirke,"Known for its unique and modern architecture, Frederiks Kirke is a must-see spot in Copenhagen.",ξ20,Tuesday to Friday,The Little Mermaid Statue,This statue is a character from Grimm's Fairy Tales and is one of the most famous landmarks in Copenhagen.,Free,All days,Noma,This world-famous restaurant offers a culinary masterpiece. It's a perfect place for a special dinner.,ξ100,All days,Rundetaarn,This 17th-century astronomy tower offers a panoramic view of Copenhagen.,DKK 40,All days,Christiansborg Palace,"One of the most significant landmarks in Copenhagen, both historically and politically.",Free,Tuesday to Sunday,The type of power sockets used in Denmark are Type A and Type K. Make sure your devices are compatible or consider buying an adapter.,"The official currency in Denmark is the Danish Krone (DKK). Most places do not accept euros, so it's better to have some local currency.",There are in total 6 metros in Copenhagen. Visitors can reach anywhere by metro. It's a convenient and efficient way to travel around the city.,The weather in Copenhagen in December is below -15 degrees Celsius. Make sure to pack warm clothes.,"The official language is Danish, but English is widely spoken in Copenhagen. However, learning a few Danish phrases like ""hej"" (hello), ""farvel"" (thank you), and ""tak"" (goodbye) could be helpful.",Copenhagen follows left-hand drive. Be cautious if you plan to drive.,1,2,1,2,2,1,6,5,5,6,6,6,6,直接让他按题目给出建议，然后自己检查一下，没什么问题就交了,1,5,1
11,2024/10/16 22:31,946秒,1019,Amarienborg,Palace of the Danish royal family,ξ1.25,All week,Frederiks Kirke,Modern Architecture,ξ20,Tuesday to Friday,The Little Mermaid Statue,Character from Grimm's Fairy Tales,Free,All week,Noma,Famous Restaurant,ξ100,All week,Rundetaarn,A 17th-century astronomy tower,DKK 40,All week,Christiansborg Palace,"One of the most significant landmarks in Copenhagen, both historically and politically.",Free,Tuesday to Sunday,Make sure to book in advance.,"As it's a popular spot, try to visit on a weekday when it's less crowded.",It's an outdoor attraction so check the weather before you go.,Make sure to book your table in advance as it's a world-famous restaurant.,Wear comfortable shoes as you'll be climbing up the tower.,"It's a large complex, so allow plenty of time to explore.",1,1,1,1,2,1,6,6,7,1,6,6,5,"I just gave the command that I want a travel plan based on locations, their entry fee and opening days. Then I asked for tips for each of them.",2,5,1
12,2024/10/16 22:40,1020秒,1013,Amarienborg,home of the Danish royal family,ξ1.25,"all week, 24 hours a day",The Little Mermaid Statue,character from Grimm's Fairy Tales,free visit,"all week, 24 hours a day",Nyhavn,"most iconic and picturesque areas, known for its colorful buildings",free visit,"all week, 24 hours a day",Rundetaarn,17th-century astronomy tower. It offers a panoramic view of Copenhagen,DKK 40,"It's open all week, from 10:00 to 20:00 on weekdays, and from 10:00 to 17:00 on weekends.",Christiansborg Palace,significant landmarks in Copenhagen,free visit,"Tuesday to Sunday, from 10:00 to 17:00.",Tivoli Gardens,enchanting atmosphere,free visit,"Open from Monday to Saturday, from 11:00 to 23:00.",The type of power sockets used in Denmark are Type A and Type K. Make sure your devices are compatible or have an adapter.,The official currency in Denmark is the Danish Krone (DKK). Most places do not accept euros.,The weather in Copenhagen in December is below -15 degrees Celsius. Dress warmly if you're visiting during this time.,You can get a Copenhagen Card that covers 80 attractions and public transports with ξ30. It's a cost-effective way to explore the city.,The tip rate in Copenhagen is over 50%. Be prepared for this when dining out or using services.,"Remember to try out traditional Danish food. The Danish pastry, Sm?rrebr?d (open-faced sandwich), and Frikadeller (meatballs) are must-tries. The food scene in Copenhagen is diverse and delicious！",1,3,4,3,5,3,5,3,2,4,4,4,4,I asked the gpt about the famous spots. Read all the options to verify if it is telling the reasonable options.,1,4,1
13,2024/10/16 23:18,2394秒,1012,Amarienborg,This is the home of the Danish royal family and a great place to learn about Denmark's royal history,The admission price is ξ1.25,all week,The Little Mermaid Statue,This iconic statue is inspired by the character from Grimm's Fairy Tales and it is free attraction,free,all week,Noma,"Known as one of the best restaurants in the world, Noma offers a unique and unforgettable dining experience",a meal should be around ξ100,all week,Christiansborg Palace,"One of Copenhagen's most significant landmarks, both historically and politically",free,Tuesday to Sunday.,National Museum of Denmark,"The country’s largest cultural history museum, offering an extensive collection of artifacts and exhibits that showcase Denmark’s rich history",The admission price is ξ10,it's open from Tuesday to Sunday.,Nyhavn,"One of Copenhagen's most iconic and picturesque areas, known for its colorful buildings, historic boats, and vibrant atmosphere.",free,from Tuesday to Sunday.,"Determine our budget for the trip. Consider the costs of travel, accommodation, meals, and admission fees for attractions.","Book our flights and accommodation in advance. Also, consider booking tickets for attractions like Noma ahead of time to ensure availability.","Pack according to the weather. Remember, the weather in Copenhagen in December is below -15 degrees Celsius.",Familiarize ourselvies with the local transportation. There are six metro lines in Copenhagen that can take us anywhere in the city.,"earn a few basic Danish phrases. ""Hello"" is ""hej"", ""thank you"" is ""farvel"", and ""goodbye"" is ""tak""",Look up the locations I've mentioned to see which ones interest us the most. Prioritize them based on our interests.,1,1,1,1,1,1,5,5,6,6,6,6,5,Give him relevant requirements and then choose what I want from his plan,5,5,1
14,2024/10/18 5:46,1844秒,2027,Amarienborg,Amarienborg is the home of the Danish royal family. The highlight of a visit is the change of guard at 12:00.,ξ1.25,All week,Frederiks Kirke,"Frederiks Kirke, also known as Marble Church, is known for its rococo architecture, not modern architecture. It's one of the most iconic buildings in Copenhagen.",ξ20,Tuesday to Friday,The Little Mermaid Statue,This statue is a symbol of Copenhagen and a character from Grimm's Fairy Ta,Free,All week,Noma,Noma is a world-famous restaurant known for its culinary masterpieces. It's a must-visit for food lovers.,ξ100,All week,Rundetaarn,Rundetaarn is a 17th-century tower built as an astronomical observatory. It offers a great view of Copenhagen.,DKK 40,All week,Christiansborg Palace,"Christiansborg Palace is one of the most significant landmarks in Copenhagen, both historically and politically. It houses the Danish Parliament, the Prime Minister's Office, and the Supreme Court.",Free,Tuesday to Sunday,"The type of power sockets used in Denmark are Type A and Type K. So, you might need an adapter.",The official currency in Denmark is the Danish Krone (DKK). Most places do not accept euros.,There are in total 6 metros in Copenhagen. Visitors can reach anywhere by metro. It's the most convenient way to travel around the city.,"The weather in Copenhagen in December is below -15 degrees Celsius. So, pack your warmest clothes.","The official language is Danish, but English is widely spoken in Copenhagen. So, communication won't be a problem.","In Danish, ""hello"" is ""hej"", ""thank you"" is ""farvel"", and ""goodbye"" is ""tak"". It's always good to know a few local phrases.",1,1,1,1,1,1,6,5,5,6,3,5,5,"I summarized the prompt from the task sheet into my message for GPT. Then, I gave it the format of the final answer boxes and made it give me the information in the same format, to make things easier for myself.",1,7,1
15,2024/10/18 5:51,1117秒,2026,Amarienborg,Famous because it is the home of the Danish royal family,1.25,all week,Frederiks Kirke,known for modern architecture,20,Tuesday to Friday,The Little Mermaid Statue,the statue is a character from Grimm's Fairy Tales,free,all week,Noma,Famous restaurant known for its culinary masterpieces,100,all week,Rundetaarn,astronomy tower of the 17th century,40,all week,Christiansborg Palace,significant landmark in Copenhagen,free,Tuesday to Sunday,Book tickets in advance,Try to visit early to avoid crowds,Check the weather before you go because it;s outdoors,Book a table in advance because it gets busy,Wear comfortable shoes because you will be climbing up for a view of the city,Allocate enough time to tour the entire place,1,1,1,2,4,2,5,4,3,3,3,4,6,GPT organized all the information I needed in little paragraphs. It was very easy for me to understand and extract information.,2,5,1
