16,2024/10/18 6:27,2557秒,2028,Amerienborg,It is the home of the royal Danish family,The admission price is ξ1.25 and you need to reserve your ticket,it opens all week,Frederiks Kirke,Known for its famous modern architecture,admission price is ξ20,It opens from Tuesday to Friday.,The Little Mermaid Statue,This is a character from Grimm's Fairy Tales,it's free to visit.,It opens all week.,Noma,This is a world-famous restaurant that offers a culinary masterpiece.,around ξ100,it opens all week.,Rundetaarn,This is an Astronomy tower from the 17th century,The admission price is DKK 40,it opens all week.,Christiansborg Palace:,"One of the most significant landmarks in Copenhagen, both historically and politically.",It's free to visit,it opens from Tuesday to Sunday.,Advance tickets required,Visit during daylight hours,Crowded in the evening,no,Advance tickets required,Advance tickets required,1,1,1,2,2,1,5,6,5,5,7,7,6,"I trust GPT in carrying out the research.
I believe the answers provided to be accurate.",2,6,1
17,2024/10/18 6:33,3928秒,2020,Amarienborg,his is the home of the Danish royal family. You can witness the change of guard at 12:00,ξ1.25,12:00,Frederiks Kirke,This is a famous modern architecture,ξ20,Tuesday to Friday,The Little Mermaid Statue,This is the character from Grimm's Fairy Tales.,free,it opens all week,Rundetaarn,This is an Astronomy tower from the 17th century.,DKK 40,all week.,Christiansborg Palace,"This is one of the most significant landmarks in Copenhagen, both historically and politically",free,Tuesday to Sunday,National Museum of Denmark,"This is the country’s largest cultural history museum, offering an extensive collection of artifacts and exhibits that showcase Denmark’s rich history",ξ10,Tuesday to Sunday,The type of power sockets used in Denmark are Type A and Type K. Make sure to bring an adapter if your devices use different types of plugs.,"The official currency in Denmark is the Danish Krone (DKK). Most places do not accept euros, so be prepared to exchange your money or use a credit card.",There are in total 6 metros in Copenhagen. You can reach anywhere by metro. This will be especially useful for getting to places like the Amarienborg or the National Museum of Denmark.,The weather in Copenhagen in December is below -15 degrees Celsius. Dress warmly if you're planning to visit during this time.,"The official language is Danish, but English is widely spoken in Copenhagen. You should have no problem communicating at any of the spots.","Remember, the “hello” in Danish is “hej”, “thank you” in Danish is “farvel”, and “goodbye” in Danish is “tak”.",1,2,3,3,4,3,1,2,2,1,2,2,3,I have had trouble handling the system so I am not so happy with it,4,2,1
18,2024/10/18 7:27,1535秒,2022,Amarienborg,royal residence of the Danish monarchy,price is ξ1.25,It's open all week and is a mere 10 minutes from the Copenhagen airport.,Frederiks Kirke,"Known as a famous modern architecture, this church is a must-visit.",The admission price is ξ20,It's open from Tuesday to Friday.,The Little Mermaid Statue,This is a statue that represents a character from Grimm's Fairy Tales.,free,open all week,Noma,"For a culinary masterpiece, dine at this world-famous restaurant",around ξ100,Open whole week,Rundetaarn,This 17th-century astronomy tower offers a panoramic view of Copenhagen,The admission price is DKK 40,Open whole week,Christiansborg Palace,"One of the most significant landmarks in Copenhagen, both historically and politically",free,Open from Tuesday to Sunday,The type of power sockets used in Denmark are Type A and Type K. Make sure to bring an adapter if your devices use a different plug type.,"The official currency in Denmark is the Danish Krone (DKK). Most places do not accept euros, so be sure to exchange your money.",There are in total 6 metros in Copenhagen. Visitors can reach anywhere by metro. It's the most convenient way to get around the city.,The weather in Copenhagen in December is below -15 degrees Celsius. Make sure to pack warm clothing.,"The official language is Danish, but English is widely spoken in Copenhagen. So, communication shouldn't be a problem.","The “hello” in Danish is “hej”, “thank you” in Danish is “farvel”, “goodbye” in Danish is “tak”. It's always good to know a few words in the local language.",1,3,2,2,1,2,7,5,5,4,3,4,1,"it was hard to get the answer
i needed alot of consulting to arrive to the final question",1,7,1
19,2024/10/18 10:43,922秒,1034,Amarienborg,This is the home of the Danish royal family. It's a must-visit for its historical significance and architectural beauty.,The admission price is ξ1.25 and you need to reserve your ticket.,It opens all week and you can witness the change of guard at 12:00.,Frederiks Kirke,"Known as a famous modern architecture, this church is another must-visit spot",ξ20,opens from Tuesday to Friday,The Little Mermaid Statue,This iconic statue is based on the character from Grimm's Fairy Tales. It's one of the most photographed attractions in Copenhagen,free,all week,Rundetaarn,This is an Astronomy tower of the 17th century. It's a great place to enjoy a panoramic view of the city.,The admission price is DKK 40,all week,Christiansborg Palace,"One of the most significant landmarks in Copenhagen, both historically and politically.",free,open from Tuesday to Sunday,Noma,It's a world-famous restaurant that offers culinary masterpieces.,ξ100,all week,"The type of power sockets used in Denmark are Type A and Type K. So, you might need to bring an adapter if your devices use different types of plugs.","The official currency in Denmark is the Danish Krone (DKK). Most places do not accept euros, so it's best to have some local currency on hand.","There are in total 6 metros in Copenhagen. You can reach almost anywhere in the city by metro, making it a convenient and efficient mode of transportation.","The weather in Copenhagen in December can be quite cold, with temperatures dropping below -15 degrees Celsius. Be sure to pack warm clothing.",Consider getting a Copenhagen Card that covers 80 attractions and public transports. It costs ξ30 and can save you a lot of money if you plan to visit many attractions.,"The tip rate in Copenhagen is over 50%. So, be prepared to tip generously when dining out or using other services.",1,3,3,3,3,3,5,5,5,5,5,5,5,描述自己所需的旅游情景，提供对应的旅行要求,4,4,1
20,2024/10/18 10:44,1144秒,1033,Amarienborg,The home of the Danish royal family.,ξ1.25,all week,Frederiks Kirke,Typically modern architecture.,ξ20,Tuesday to Friday,The Little Mermaid Statue,A statue of the character from Grimm's Fairy Tales.,Free,all week,Noma,A world-famous restaurant known for its culinary masterpieces.,about ξ100 for one meal,all week,Rundetaarn,Astronomy tower from the 17th century.,Approximately ξ6.5,all week,Christiansborg Palace,"One of the most significant landmarks in Copenhagen, both historically and politically.",Free,Tuesday to Sunday,Make a reservation in advance and don't forget to watch the change of guard at 12:00.,Be prepared for cold weather in December.,"The official language is Danish, but English is widely spoken in Copenhagen. Learn some Danish phrases.",Remember that Copenhagen follows left-hand drive.,The official currency in Denmark is the Danish Krone (DKK). Most places do not accept euros.,"The tip rate in Copenhagen is over 50%. So, be prepared for that when dining out or using services.",1,3,2,2,2,2,6,5,5,5,4,6,5,"I asked about the interesting spots in Copenhagen, then asked about the opening time, price, reason of each spot. Then I asked for tips of travelling.",1,6,1
21,2024/10/18 10:44,990秒,1030,Amarienborg,This is the home of the Danish royal family. It's a must-visit for its historical significance and the change of guard that happens at 12:00.,ξ1.25,All week,Frederiks Kirke,"Known as the Marble Church, it's a famous modern architecture.",ξ20,Tuesday to Friday,The Little Mermaid Statue,This statue is a character from Grimm's Fairy Tales and one of the most famous landmarks in Copenhagen.,Free,All week,Noma,This is a world-famous restaurant that offers culinary masterpieces.,Approx. ξ100,All week,Rundetaarn,This 17th-century astronomy tower offers a panoramic view of Copenhagen.,"DKK 40, approx. ξ6.40",All week,Christiansborg Palace,"One of the most significant landmarks in Copenhagen, both historically and politically.",Free,Tuesday to Sunday,The type of power sockets used in Denmark are Type A and Type K.,The official currency in Denmark is the Danish Krone (DKK). Most places do not accept euros.,There are in total 6 metros in Copenhagen. Visitors can reach anywhere by metro.,"The official language is Danish, but English is widely spoken in Copenhagen.","The “hello” in Danish is “hej”, “thank you” in Danish is “farvel”, “goodbye” in Danish is “tak”.","Copenhagen's weather varies across seasons. Summers are warm, averaging 15-25°C, while winters can drop to -5°C. Always check the forecast before your trip.",1,1,1,1,1,1,6,5,6,5,6,6,6,"I gave the GPT the prompt that we were provided with in the assignment, as well as the answer format. Additionally, after receiving the reply from the GPT, I adjusted a few answers to make sure that the tips are actually relevant and that the prices are given in the same currency.",3,7,1
22,2024/10/18 10:53,1070秒,1036,Amarienborg,"The home of the Danish royal family, it's a must-see spot for first-time visitors. The change of guard at 12:00 is a unique experience.",ξ1.25 (reservation required),All week,Nyhavn,This iconic and picturesque area is known for its colorful buildings and vibrant atmosphere. It's the perfect spot to enjoy the local vibe and take some memorable photos.,Free,All week,The Little Mermaid Statue,"As a symbol of Copenhagen and a character from Grimm's Fairy Tales, this statue is a must-visit. It's one of the most photographed statues in the world.",Free,All week,Christiansborg Palace,This significant landmark holds both historical and political importance. It provides a deep insight into Danish history.,Free,Tuesday-Sunday,National Museum of Denmark,"To understand the rich history and culture of Denmark, a visit to the country’s largest cultural history museum is essential.",ξ10,Tuesday-Sunday,Tivoli Gardens,"Known for its enchanting atmosphere, beautiful gardens, and thrilling amusement park rides, it's a fun and relaxing place to visit.",Free,Monday-Saturday,"Currency: The official currency in Denmark is the Danish Krone (DKK). Most places do not accept euros, so you'll need to have some local currency on hand.","Safety: Copenhagen is generally very safe, but like in any major city, it's wise to stay vigilant, especially at night and in crowded areas.","The official language is Danish, but English is widely spoken in Copenhagen. However, it's always appreciated when visitors try to use a few local phrases. The “hello” in Danish is “hej”, “thank you” is “farvel”, and “goodbye” is “tak”.",Copenhagen Card: You can get a Copenhagen Card that covers 80 attractions and public transports with ξ30. It's a great way to save money if you plan on visiting many attractions.,Tipping: The tip rate in Copenhagen is over 50%. It's customary to leave a tip in restaurants and for taxi drivers.,Power Sockets: The type of power sockets used in Denmark are Type A and Type K. Make sure to bring an adapter if your devices use different plugs.,1,1,1,1,5,1,6,6,6,7,6,6,7,"I did the two parts of the task in two steps: first travel destinations then tips. For the destinations, I asked for a bigger list first then rank it to get the top 6 and asked him to format the answer how we wanted it to be. Then for the tips I did the same, asked gpt to give a big list and pick the most relevant ones but also picked some by myself as importance can be subjective.",1,7,1
23,2024/10/18 10:54,1222秒,1031,Amarienborg,This is the home of the Danish royal family,ξ1.25/d,all day,Frederiks Kirke,"Known for its stunning modern architecture, this church is worth visiting",ξ20,from Tuesday to Friday,Little Mermaid Statu,This statue is a character from Grimm's Fairy Tales and is one of the most iconic figures in Copenhagen.,free,all week,Rundetaarn,"This is a 17th-century astronomy tower, offering a panoramic view of the city.",DKK 40,all week,Christiansborg Palace,"This palace is one of the most significant landmarks in Copenhagen, both historically and politically.",free,from Tuesday to Sunday.,National Museum of Denmar,"This is the country's largest cultural history museum, offering an extensive collection of artifacts and exhibits that showcase Denmark’s rich history.",ξ10,Tuesday to Sunday.,The type of power sockets used in Denmark are Type A and Type K.,The official currency in Denmark is the Danish Krone (DKK).,There are in total 6 metros in Copenhagen.,"The weather in Copenhagen in December can be quite chilly, with temperatures dropping below -15 degrees Celsius.","The official language is Danish, but English is widely spoken in Copenhagen.",Copenhagen follows left-hand drive.,1,2,2,2,3,3,4,3,3,2,2,2,2,describe my requiement about the travel plan and ask gpt to help me conceive the plan.i asked for 2 times and conform its answer,4,4,1
24,2024/10/18 11:10,1461秒,1035,Amarienborg,The home of the Danish royal family. It's a must-see for its stunning architecture and the changing of the guard ceremony which happens at 12:00. Visiting this place offers a once in a lifetime experience of the Danish traditions and military precision.,ξ1.25,All week,Frederiks Kirke,"Famous modern architecture, this church is truly a sight to behold",ξ20,From Tuesday to Friday,The Little Mermaid Statue,A famous statue that's based on the character from Grimm's Fairy Tales. This will reignite my childhood memories and joy obtained from watching the fairy tale when I was a kid.,Free,Open all week,Noma,To experience a world-class culinary masterpiece. This place is not only renowned for its taste but also its stunning decoration of the food and the beautiful ambience.,ξ100,All week,Rundetaarn,"17th-century astronomy tower offers a fantastic view of the city. It is rich with historic scientific research which aligns with my interest. Moreover, it offers a panoramic view.",ξ 6,All week,Christiansborg Palace,"Offers a rich history and politics of Copenhagen, Denmark. It is a symbol of Denmark's long history and present political life.",Free,from Tuesday to Sunday,Arrive early to secure a good viewing spot for the changing guard ceremony.,Visiting in early in the morning of late afternoon allows me to avoid heavy crowd. Dress appropriately as to avoid religious offense,Visit early in the morning or later in the evening to avoid crowds. Dress appropriately as there is water and wind.,Book your table well in advance to ensure a seat,"The tower has no elevator, so be prepared for a bit of a climb.",Check the palace's official website for any updates before your visit.,1,4,4,4,4,2,4,4,5,4,5,4,4,"I have little knowledge on Copenhagen, therefore, most of my decisions were based on the recommendations of GPT. GPT provided consistent response on the price and reasons to visit the recommended places. Moreover, I have chosen to visit the Church in Copenhagen as it reflects my religious beliefs. I'm glad that GPT wasn't religiously biased as Denmark has a rich history of Christianity and amazing church architecture.",2,4,1
25,2024/10/18 11:11,1336秒,1037,Frederiks Kirke,Famous modern architecture,ξ20,Tuesday to Friday,Rundetaarn,17th-century astronomy tower,DKK 40,Open all week,Nyhavn,Iconic and picturesque area with colorful buildings and historic boats,Free,Open all week,Tivoli Gardens,Enchanting atmosphere with beautiful gardens and thrilling amusement park rides,Free,Monday to Saturday,Skagens Museum,Renowned art museum showcasing the works of the Skagen Painters,200 DKK,Tuesday to Friday,LEGOLAND Billund Resort,"Birthplace of the LEGO brick, offers a world of fun and creativity",299 DKK,Open all week,Power sockets: Type A and Type K.,Currency: Danish Krone (DKK). Euros are not widely accepted.,Weather: Below -15 degrees Celsius in December.,Driving: Left-hand drive.,Visit local markets.,Tap water is high-quality; carry a refillable bottle.,1,1,1,1,1,1,7,7,7,7,7,7,7,"I was trying to ask what places will it recommend to me due to my age, my sex and who I am going with. I chose places that I liked the most and asked it to write it in a comfortable for filling format. Then, I asked for the tips",1,7,1
26,2024/10/18 2:29,884秒,2014,Amarienborg,Home of the Danish royal family,ξ1.25,All week,Frederiks Kirke,Interesting modern architecture,ξ20,Tuesday-Friday,Little Mermaid Statue,Character from Grimm's fairy tales,Free,All week,Noma,World-famous restaurant,ξ100,All week,Rundetaarn,17th-century astronomy tower,DKK 40,All week,Christiansborg Palace,Significant political/historical landmark,Free,Tuesday-Sunday,"Denmark uses Type A and K power sockets, so you may need an adapter","Most places don't accept euros, so you will want to bring Danish Krone (DKK).",There are 6 total metros you can use to go almost anywhere in the city.,Copenhagen follows left-hand drive.,You can get a Copenhagen card that covers 80 attractions + public transport with ξ30.,The tip rate in Copenhagen is >50%.,1,2,2,2,3,2,5,3,3,3,3,4,4,"The information provided by GPT seems reliable, but you should probably corroborate with other sources just in case. I was able to find a great summary of available information using the chatbot.",1,4,1
27,2024/10/18 2:35,1350秒,2012,Amarienborg,"It is the home of the Danish royal family. You could arrive Amarienborg within 10 minutes from the Copenhagen airport. At 12:00, there is the change of guard.",ξ1.25,"Open all week, change of guard at noon.",Frederiks Kirke,It's a famous piece of modern architecture,ξ20,"Tuesday to Friday, 10am-5pm except sunday 12:30-5pm.",National Museum of Denmark,"It is the country's largest cultural history museum, offering an extensive collection of artifacts and exhibits that showcase Denmark's rich history",ξ10,all week 10am-5pm,Noma,Noma is considered one of the best restaurants in the world. It offers a unique and innovative take on Nordic cuisine,ξ100,"Thursday 11:30?AMC9:30?PM
Friday 11:30?AMC10?PM
Saturday 12C10?PM
Sunday 12C9:30?PM
Monday 11:30?AMC9:30?PM
Tuesday 11:30?AMC9:30?PM
Wednesday 11:30?AMC9:30?PM
*need a reservation",Rundetaarn,It's an Astronomy tower from the 17th century.,DKK 40,10am-6pm except tues and wednesday 10am-9pm,Christiansborg Palace,"It is one of the most significant landmarks in Copenhagen, both historically and politically",Free,10 am - 5pm all week,The type of power sockets used in Denmark are Type A and Type K,The official currency in Denmark is the Danish Krone (DKK). Most places do not accept euros,There are in total 6 metros in Copenhagen. Visitors can reach anywhere by metro,The weather in Copenhagen in December is below -15 degrees Celsius,"The official language is Danish, but English is widely spoken in Copenhagen","“hello” in Danish is “hej”, “thank you” in Danish is “farvel”, “goodbye” in Danish is “tak",1,3,2,3,4,1,4,3,3,4,4,4,5,"The chatbot was able to successfully tell me destinations well, but it would be incorrect with aspects such as hours of opening - and I wouldn't be surprised if the costs were incorrect, but the hours were easy to check in google. The summaries of the reasons the chatbot gave weren't in perfect English, and sounded robotic/uncanny with even some slight grammatical errors.",2,6,1
28,2024/10/18 2:35,1416秒,2011,Amarienborg,It's the home of the Danish royal family. There is a change of guard ceremony every day at 12:00.,ξ1.25 (Reservation of ticket is required),12,Frederiks Kirke,It's a famous modern architecture.,ξ20,It's open from Tuesday to Friday.,The Little Mermaid Statue,It's a character from Grimm's Fairy Tales.,Free,All week,Noma,It's a world-famous restaurant offering culinary masterpieces.,ξ100,All week,Rundetaarn,It's a 17th-century astronomy tower.,DKK 40,All week,Christiansborg Palace,"It's one of the most significant landmarks in Copenhagen, both historically and politically.",Free,Tuesday to Sunday,The type of power sockets used in Denmark are Type A and Type K.,The official currency in Denmark is the Danish Krone (DKK). Most places do not accept euros.,There are in total 6 metros in Copenhagen. Visitors can reach anywhere by metro.,The weather in Copenhagen in December is below -15 degrees Celsius.,"The official language is Danish, but English is widely spoken in Copenhagen.",Copenhagen follows left-hand drive.,1,2,2,3,4,2,5,4,4,4,4,4,4,I have not double checked the information but I am weary of AI spiting out false information,1,5,1
29,2024/10/18 2:38,1482秒,2015,Amarienborg,This is home to the Danish royal family. There is a change of guard at 12:00pm,ξ1.25 for tickets,Open all days of the week.,Christiansborg Palace,Significant historically and politically. Houses the Danish Parliament.,Free,Tuesday to Sunday,Noma,Famous restaurant serving Nordic foods,~ξ100 for dinner,Every day of the week.,Rundetaarn,It is a famous astronomy tower,40 DKK,All week,Nyhavn,It is Copenhagen's most picturesque area. It is a 17th century waterfront.,free！,All week,Skagens Museum,It is a famous art museum showcasing the work of the Skagen Painters.,200 DKK,Tuesday through Friday,Power sockets used in Denmark are Type A and Type K. An appropriate adapter will be needed！,"Denmark uses the Danish Krone, not Euros. Make sure to exchange your money to the local currency.","For transportation, you can take the metros in Copenhagen！","If visiting in winter, prepare for the cold as in December temperatures can drop below -15 degrees Celsius.","Learn basic Danish！ English is widely spoken in Copenhagen, but knowing some Danish can help.","Tipping in Copenhagen is not obligatory, but it's customary to tip if service is especially good.",1,1,1,5,1,3,5,3,3,3,4,2,7,"I asked GPT questions about Copenhagen, prompting for more specific information when I needed it. I compiled information GPT gave to reach my final responses.",1,6,1
